<?xml version="1.0" encoding="UTF-8"?>
<!DOCTYPE aerolinea SYSTEM "aerolinea.dtd">
<aerolinea>
    <viaje nombreempresa="aerolineaA" fecha="20/16/2015">
        <datosvuelo nombretrayecto="trayectoprueba" origen="Medellin" destino="Bogota">
            <escala ciudad="California" hora="10:08pm" id="1">
                
            </escala>
        </datosvuelo>
        <datosavion referenciaavion="efd" nombrecapitan="Carlos" pasajeros="50" observaciones="">
            
        </datosavion>
    </viaje>
    
    <viaje nombreempresa="aerolineaA" fecha="20/16/2015">
        <datosvuelo nombretrayecto="trayectoprueba" origen="Medellin" destino="Bogota">
            <tiempoduracion horasalida="09:05pm" horallegada="10:08pm" tiempototal="1">
                
            </tiempoduracion>
        </datosvuelo>
        <datosavion referenciaavion="efd" nombrecapitan="Miguel" pasajeros="50" observaciones="">
            
        </datosavion>
    </viaje>

</aerolinea>
